[
  {
    "spelling": "agree",
    "pos": "vi. vt.",
    "frames": [
      "SV",
      "SV_PREP_O",
      "SV_COMP"
    ],
    "fixed_preposition": "with",
    "complement_types": [
      "to_infinitive",
      "that_clause"
    ],
    "subject_restriction": "person",
    "allows_passive": "no",
    "stative_policy": "usually_stative",
    "provenance": {
      "source": "curated_by_agent",
      "reviewed": true,
      "confidence": "high",
      "checked_at": "2026-07-30"
    }
  },
  {
    "spelling": "arrive",
    "pos": "vi.",
    "frames": [
      "SV"
    ],
    "notes": "地点用 at(小)/in(大)，属状语非补语",
    "stative_policy": "dynamic",
    "allows_passive": "no",
    "provenance": {
      "source": "curated_by_agent",
      "reviewed": true,
      "confidence": "high",
      "checked_at": "2026-07-30"
    }
  },
  {
    "spelling": "ask",
    "pos": "vt.",
    "frames": [
      "SVO",
      "SVOO",
      "SVOC"
    ],
    "dative_alternation": "none",
    "complement_types": [
      "to_infinitive"
    ],
    "subject_restriction": "person",
    "notes": "ask him a question；双宾不可改介词句",
    "stative_policy": "dynamic",
    "allows_passive": "yes",
    "provenance": {
      "source": "curated_by_agent",
      "reviewed": true,
      "confidence": "high",
      "checked_at": "2026-07-30"
    }
  },
  {
    "spelling": "be",
    "pos": "vlink.",
    "frames": [
      "SVP"
    ],
    "copula": true,
    "allows_passive": "no",
    "notes": "唯一纯系动词；变位由 paradigms/auxiliaries.json 提供",
    "stative_policy": "usually_stative",
    "provenance": {
      "source": "curated_by_agent",
      "reviewed": true,
      "confidence": "high",
      "checked_at": "2026-07-30"
    }
  },
  {
    "spelling": "become",
    "pos": "vi.",
    "frames": [
      "SVP"
    ],
    "copula": true,
    "allows_passive": "no",
    "complement_types": [
      "adjective",
      "noun_phrase"
    ],
    "stative_policy": "dynamic",
    "provenance": {
      "source": "curated_by_agent",
      "reviewed": true,
      "confidence": "high",
      "checked_at": "2026-07-30"
    }
  },
  {
    "spelling": "begin",
    "pos": "vi. vt.",
    "frames": [
      "SV",
      "SVO",
      "SV_COMP"
    ],
    "complement_types": [
      "gerund",
      "to_infinitive"
    ],
    "stative_policy": "dynamic",
    "allows_passive": "yes",
    "provenance": {
      "source": "curated_by_agent",
      "reviewed": true,
      "confidence": "high",
      "checked_at": "2026-07-30"
    }
  },
  {
    "spelling": "believe",
    "pos": "vi. vt.",
    "frames": [
      "SVO",
      "SV_COMP"
    ],
    "complement_types": [
      "that_clause"
    ],
    "subject_restriction": "person",
    "stative_policy": "usually_stative",
    "allows_passive": "yes",
    "provenance": {
      "source": "curated_by_agent",
      "reviewed": true,
      "confidence": "high",
      "checked_at": "2026-07-30"
    }
  },
  {
    "spelling": "belong",
    "pos": "vi.",
    "frames": [
      "SV_PREP_O"
    ],
    "fixed_preposition": "to",
    "allows_passive": "no",
    "stative_policy": "usually_stative",
    "provenance": {
      "source": "curated_by_agent",
      "reviewed": true,
      "confidence": "high",
      "checked_at": "2026-07-30"
    }
  },
  {
    "spelling": "borrow",
    "pos": "vt.",
    "frames": [
      "SVO"
    ],
    "subject_restriction": "person",
    "stative_policy": "dynamic",
    "allows_passive": "yes",
    "provenance": {
      "source": "curated_by_agent",
      "reviewed": true,
      "confidence": "high",
      "checked_at": "2026-07-30"
    }
  },
  {
    "spelling": "break",
    "pos": "vi. vt.",
    "frames": [
      "SV",
      "SVO"
    ],
    "notes": "The window broke（作格动词）",
    "stative_policy": "dynamic",
    "allows_passive": "yes",
    "provenance": {
      "source": "curated_by_agent",
      "reviewed": true,
      "confidence": "high",
      "checked_at": "2026-07-30"
    }
  },
  {
    "spelling": "bring",
    "pos": "vt.",
    "frames": [
      "SVO",
      "SVOO"
    ],
    "dative_alternation": "to",
    "stative_policy": "dynamic",
    "allows_passive": "yes",
    "provenance": {
      "source": "curated_by_agent",
      "reviewed": true,
      "confidence": "high",
      "checked_at": "2026-07-30"
    }
  },
  {
    "spelling": "build",
    "pos": "vt.",
    "frames": [
      "SVO"
    ],
    "subject_restriction": "person",
    "stative_policy": "dynamic",
    "allows_passive": "yes",
    "provenance": {
      "source": "curated_by_agent",
      "reviewed": true,
      "confidence": "high",
      "checked_at": "2026-07-30"
    }
  },
  {
    "spelling": "buy",
    "pos": "vt.",
    "frames": [
      "SVO",
      "SVOO"
    ],
    "dative_alternation": "for",
    "subject_restriction": "person",
    "stative_policy": "dynamic",
    "allows_passive": "yes",
    "provenance": {
      "source": "curated_by_agent",
      "reviewed": true,
      "confidence": "high",
      "checked_at": "2026-07-30"
    }
  },
  {
    "spelling": "call",
    "pos": "vt.",
    "frames": [
      "SVO",
      "SVOC"
    ],
    "complement_types": [
      "noun_phrase"
    ],
    "notes": "call him Tom",
    "stative_policy": "dynamic",
    "allows_passive": "yes",
    "provenance": {
      "source": "curated_by_agent",
      "reviewed": true,
      "confidence": "high",
      "checked_at": "2026-07-30"
    }
  },
  {
    "spelling": "carry",
    "pos": "vt.",
    "frames": [
      "SVO"
    ],
    "stative_policy": "dynamic",
    "allows_passive": "yes",
    "provenance": {
      "source": "curated_by_agent",
      "reviewed": true,
      "confidence": "high",
      "checked_at": "2026-07-30"
    }
  },
  {
    "spelling": "catch",
    "pos": "vt.",
    "frames": [
      "SVO"
    ],
    "subject_restriction": "animate",
    "stative_policy": "dynamic",
    "allows_passive": "yes",
    "provenance": {
      "source": "curated_by_agent",
      "reviewed": true,
      "confidence": "high",
      "checked_at": "2026-07-30"
    }
  },
  {
    "spelling": "choose",
    "pos": "vt.",
    "frames": [
      "SVO"
    ],
    "subject_restriction": "person",
    "stative_policy": "dynamic",
    "allows_passive": "yes",
    "provenance": {
      "source": "curated_by_agent",
      "reviewed": true,
      "confidence": "high",
      "checked_at": "2026-07-30"
    }
  },
  {
    "spelling": "clean",
    "pos": "vt.",
    "frames": [
      "SVO"
    ],
    "stative_policy": "dynamic",
    "allows_passive": "yes",
    "provenance": {
      "source": "curated_by_agent",
      "reviewed": true,
      "confidence": "high",
      "checked_at": "2026-07-30"
    }
  },
  {
    "spelling": "close",
    "pos": "vt.",
    "frames": [
      "SVO"
    ],
    "stative_policy": "dynamic",
    "allows_passive": "yes",
    "provenance": {
      "source": "curated_by_agent",
      "reviewed": true,
      "confidence": "high",
      "checked_at": "2026-07-30"
    }
  },
  {
    "spelling": "come",
    "pos": "vi.",
    "frames": [
      "SV"
    ],
    "stative_policy": "dynamic",
    "allows_passive": "no",
    "provenance": {
      "source": "curated_by_agent",
      "reviewed": true,
      "confidence": "high",
      "checked_at": "2026-07-30"
    }
  },
  {
    "spelling": "cook",
    "pos": "vt.",
    "frames": [
      "SVO",
      "SVOO"
    ],
    "dative_alternation": "for",
    "object_optional": true,
    "subject_restriction": "person",
    "stative_policy": "dynamic",
    "allows_passive": "yes",
    "provenance": {
      "source": "curated_by_agent",
      "reviewed": true,
      "confidence": "high",
      "checked_at": "2026-07-30"
    }
  },
  {
    "spelling": "count",
    "pos": "vi. vt.",
    "frames": [
      "SV",
      "SVO"
    ],
    "subject_restriction": "person",
    "stative_policy": "dynamic",
    "allows_passive": "yes",
    "provenance": {
      "source": "curated_by_agent",
      "reviewed": true,
      "confidence": "high",
      "checked_at": "2026-07-30"
    }
  },
  {
    "spelling": "cry",
    "pos": "vi. vt.",
    "frames": [
      "SV"
    ],
    "subject_restriction": "person",
    "stative_policy": "dynamic",
    "allows_passive": "no",
    "provenance": {
      "source": "curated_by_agent",
      "reviewed": true,
      "confidence": "high",
      "checked_at": "2026-07-30"
    }
  },
  {
    "spelling": "cut",
    "pos": "vt.",
    "frames": [
      "SVO"
    ],
    "stative_policy": "dynamic",
    "allows_passive": "yes",
    "provenance": {
      "source": "curated_by_agent",
      "reviewed": true,
      "confidence": "high",
      "checked_at": "2026-07-30"
    }
  },
  {
    "spelling": "dance",
    "pos": "vi.",
    "frames": [
      "SV"
    ],
    "subject_restriction": "person",
    "stative_policy": "dynamic",
    "allows_passive": "no",
    "provenance": {
      "source": "curated_by_agent",
      "reviewed": true,
      "confidence": "high",
      "checked_at": "2026-07-30"
    }
  },
  {
    "spelling": "decide",
    "pos": "vi. vt.",
    "frames": [
      "SV_COMP"
    ],
    "complement_types": [
      "to_infinitive",
      "that_clause"
    ],
    "subject_restriction": "person",
    "stative_policy": "dynamic",
    "allows_passive": "no",
    "provenance": {
      "source": "curated_by_agent",
      "reviewed": true,
      "confidence": "high",
      "checked_at": "2026-07-30"
    }
  },
  {
    "spelling": "draw",
    "pos": "vt.",
    "frames": [
      "SVO"
    ],
    "object_optional": true,
    "subject_restriction": "person",
    "stative_policy": "dynamic",
    "allows_passive": "yes",
    "provenance": {
      "source": "curated_by_agent",
      "reviewed": true,
      "confidence": "high",
      "checked_at": "2026-07-30"
    }
  },
  {
    "spelling": "drink",
    "pos": "vt.",
    "frames": [
      "SVO"
    ],
    "object_optional": true,
    "subject_restriction": "animate",
    "object_restriction": "drinkable",
    "stative_policy": "dynamic",
    "allows_passive": "yes",
    "provenance": {